{
  "$schema": "./catalog.schema.json",
  "schema_version": 1,
  "verified_on": "2026-07-19",
  "providers": [
    {
      "id": "augment",
      "name": "Augment Code CLI",
      "vendor": "Augment Code",
      "surface": "cli",
      "integration_mode": "command_hooks",
      "config_format": "json",
      "config_paths": [
        "/etc/augment/settings.json",
        "C:\\ProgramData\\Augment\\settings.json",
        ".augment/settings.local.json",
        ".augment/settings.json",
        "~/.augment/settings.json"
      ],
      "events": { "before_tool": "PreToolUse", "after_tool": "PostToolUse" },
      "event_fields": { "name": "tool_name", "input": "tool_input", "session": "conversation_id" },
      "blocking": { "mechanism": "exit_code_2", "failure_mode": "fail_open" },
      "adapters": { "node": true, "python": true, "go": true },
      "delivery_state": "available",
      "source_url": "https://docs.augmentcode.com/cli/hooks"
    },
    {
      "id": "claudecode",
      "name": "Claude Code",
      "vendor": "Anthropic",
      "surface": "cli",
      "integration_mode": "command_hooks",
      "config_format": "json",
      "config_paths": [
        "$CLAUDE_CONFIG_DIR/settings.json",
        "~/.claude/settings.json",
        ".claude/settings.json",
        ".claude/settings.local.json"
      ],
      "events": {
        "before_tool": "PreToolUse",
        "after_tool": "PostToolUse",
        "after_tool_failure": "PostToolUseFailure"
      },
      "event_fields": {
        "name": "tool_name",
        "input": "tool_input",
        "session": "session_id",
        "call_id": "tool_use_id",
        "output": "tool_response",
        "error": "error"
      },
      "blocking": { "mechanism": "exit_code_2", "failure_mode": "fail_open" },
      "adapters": { "node": true, "python": true, "go": true },
      "delivery_state": "available",
      "source_url": "https://code.claude.com/docs/en/hooks"
    },
    {
      "id": "cline",
      "name": "Cline",
      "vendor": "Cline",
      "surface": "cli_and_ide",
      "integration_mode": "command_hooks",
      "config_format": "script",
      "config_paths": [
        "~/Documents/Cline/Hooks/",
        "$CLINE_DIR/hooks/",
        ".clinerules/hooks/",
        ".cline/hooks/"
      ],
      "events": { "before_tool": "PreToolUse", "after_tool": "PostToolUse" },
      "event_fields": { "name": "tool_call.name/tool_result.name", "input": "tool_call.input/tool_result.input", "session": "taskId" },
      "blocking": { "mechanism": "json_stdout_cancel", "failure_mode": "fail_open" },
      "adapters": { "node": true, "python": true, "go": true },
      "delivery_state": "available",
      "source_url": "https://github.com/cline/cline/blob/main/sdk/examples/hooks/README.md"
    },
    {
      "id": "codex",
      "name": "OpenAI Codex",
      "vendor": "OpenAI",
      "surface": "cli",
      "integration_mode": "command_hooks",
      "config_format": "json",
      "config_paths": ["$CODEX_HOME/hooks.json", "~/.codex/hooks.json", ".codex/hooks.json"],
      "events": { "before_tool": "PreToolUse", "after_tool": "PostToolUse" },
      "event_fields": { "name": "tool_name", "input": "tool_input", "session": "session_id" },
      "blocking": { "mechanism": "exit_code_2", "failure_mode": "fail_open" },
      "contract_variants": [
        {
          "id": "inlinetoml",
          "release_channel": "stable",
          "activation": "Hooks configured inline in an active Codex config.toml or managed requirements.toml layer",
          "config_format": "toml",
          "config_paths": [
            "$CODEX_HOME/config.toml",
            "~/.codex/config.toml",
            ".codex/config.toml",
            "requirements.toml"
          ],
          "events": { "before_tool": "PreToolUse", "after_tool": "PostToolUse" },
          "event_fields": { "name": "tool_name", "input": "tool_input", "session": "session_id" },
          "blocking": { "mechanism": "exit_code_2", "failure_mode": "fail_open" },
          "source_url": "https://learn.chatgpt.com/docs/hooks"
        },
        {
          "id": "pluginbundle",
          "release_channel": "stable",
          "activation": "An enabled Codex plugin supplies hooks through its manifest or default hooks file",
          "config_format": "plugin",
          "config_paths": [
            ".codex-plugin/plugin.json",
            "hooks/hooks.json"
          ],
          "events": { "before_tool": "PreToolUse", "after_tool": "PostToolUse" },
          "event_fields": { "name": "tool_name", "input": "tool_input", "session": "session_id" },
          "blocking": { "mechanism": "exit_code_2", "failure_mode": "fail_open" },
          "source_url": "https://learn.chatgpt.com/docs/hooks"
        }
      ],
      "adapters": { "node": true, "python": true, "go": true },
      "delivery_state": "available",
      "source_url": "https://learn.chatgpt.com/docs/hooks"
    },
    {
      "id": "copilot",
      "name": "GitHub Copilot",
      "vendor": "GitHub",
      "surface": "cli",
      "integration_mode": "command_hooks",
      "config_format": "json",
      "config_paths": [
        "$COPILOT_HOME/hooks/*.json",
        "~/.copilot/hooks/*.json",
        ".github/hooks/*.json"
      ],
      "events": { "before_tool": "preToolUse", "after_tool": "postToolUse" },
      "event_fields": { "name": "toolName", "input": "toolArgs", "session": "sessionId" },
      "blocking": {
        "mechanism": "any_nonzero_exit",
        "failure_mode": "fail_closed",
        "timeout_failure_mode": "fail_open"
      },
      "adapters": { "node": true, "python": true, "go": true },
      "delivery_state": "available",
      "source_url": "https://docs.github.com/en/copilot/reference/hooks-reference"
    },
    {
      "id": "cursor",
      "name": "Cursor",
      "vendor": "Anysphere",
      "surface": "cli_and_ide",
      "integration_mode": "command_hooks",
      "config_format": "json",
      "config_paths": [
        "/Library/Application Support/Cursor/hooks.json",
        "/etc/cursor/hooks.json",
        "C:\\ProgramData\\Cursor\\hooks.json",
        ".cursor/hooks.json",
        "~/.cursor/hooks.json"
      ],
      "events": { "before_tool": "preToolUse", "after_tool": "postToolUse" },
      "event_fields": { "name": "tool_name", "input": "tool_input", "session": "conversation_id" },
      "blocking": { "mechanism": "exit_code_2", "failure_mode": "configurable" },
      "adapters": { "node": true, "python": true, "go": true },
      "delivery_state": "available",
      "source_url": "https://cursor.com/docs/hooks"
    },
    {
      "id": "droid",
      "name": "Factory Droid",
      "vendor": "Factory",
      "surface": "cli",
      "integration_mode": "command_hooks",
      "config_format": "json",
      "config_paths": [
        "~/.factory/hooks.json",
        "~/.factory/settings.json",
        ".factory/hooks.json",
        ".factory/settings.json"
      ],
      "events": { "before_tool": "PreToolUse", "after_tool": "PostToolUse" },
      "event_fields": { "name": "tool_name", "input": "tool_input", "session": "session_id" },
      "blocking": { "mechanism": "exit_code_2", "failure_mode": "fail_open" },
      "adapters": { "node": true, "python": true, "go": true },
      "delivery_state": "available",
      "source_url": "https://docs.factory.ai/reference/hooks-reference",
      "contract_variants": [
        {
          "id": "nestedhooks",
          "release_channel": "legacy",
          "activation": "An existing nested hooks file remains active until Droid saves and archives it",
          "config_format": "json",
          "config_paths": [
            "~/.factory/hooks/hooks.json",
            ".factory/hooks/hooks.json"
          ],
          "events": { "before_tool": "PreToolUse", "after_tool": "PostToolUse" },
          "event_fields": { "name": "tool_name", "input": "tool_input", "session": "session_id" },
          "blocking": { "mechanism": "exit_code_2", "failure_mode": "fail_open" },
          "source_url": "https://docs.factory.ai/reference/hooks-reference"
        }
      ]
    },
    {
      "id": "gemini",
      "name": "Gemini CLI",
      "vendor": "Google",
      "surface": "cli",
      "integration_mode": "command_hooks",
      "config_format": "json",
      "config_paths": [
        "$GEMINI_CLI_HOME/.gemini/settings.json",
        "~/.gemini/settings.json",
        ".gemini/settings.json",
        "$GEMINI_CLI_SYSTEM_DEFAULTS_PATH",
        "$GEMINI_CLI_SYSTEM_SETTINGS_PATH",
        "/Library/Application Support/GeminiCli/system-defaults.json",
        "/Library/Application Support/GeminiCli/settings.json",
        "/etc/gemini-cli/system-defaults.json",
        "/etc/gemini-cli/settings.json",
        "C:\\ProgramData\\gemini-cli\\system-defaults.json",
        "C:\\ProgramData\\gemini-cli\\settings.json"
      ],
      "events": { "before_tool": "BeforeTool", "after_tool": "AfterTool" },
      "event_fields": {
        "name": "tool_name",
        "input": "tool_input",
        "session": "session_id",
        "output": "tool_response",
        "error": "tool_response.error"
      },
      "blocking": { "mechanism": "exit_code_2", "failure_mode": "fail_open" },
      "adapters": { "node": true, "python": true, "go": true },
      "delivery_state": "available",
      "source_url": "https://geminicli.com/docs/hooks/reference/"
    },
    {
      "id": "grok",
      "name": "Grok Build",
      "vendor": "xAI",
      "surface": "cli",
      "integration_mode": "command_hooks",
      "config_format": "json",
      "config_paths": [
        "$GROK_HOME/hooks/*.json",
        "~/.grok/hooks/*.json",
        "~/.grok/hooks-paths",
        ".grok/hooks/*.json",
        ".claude/settings.json",
        ".cursor/hooks.json"
      ],
      "events": {
        "before_tool": "PreToolUse",
        "after_tool": "PostToolUse",
        "after_tool_failure": "PostToolUseFailure"
      },
      "event_fields": {